<?xml version="1.0" encoding="UTF-8"?>
<!DOCTYPE Rules SYSTEM "Designer.dtd" >
<Rules>
  <RuleCategory name="general">
    <Description>General</Description>
    <Description xml:lang="ja">一般</Description>
    <RuleTemplate name="NewRule" icon="new.gif" file="NewRule.rtu" process="true" workstep="true">
      <Description>New Rule</Description>
      <Description xml:lang="ja">新規ルール</Description>
      <Description xml:lang="zh">新规则</Description>
    </RuleTemplate>
    <RuleTemplate name="Schedule" icon="schedule.gif" file="Schedule.rtu" process="true" workstep="false">
      <Description>Schedule</Description>
      <Description xml:lang="ja">スケジュール</Description>
      <Description xml:lang="zh">超时</Description>
    </RuleTemplate>
  </RuleCategory>
  <RuleCategory name="notification">
    <Description>Notification</Description>
    <Description xml:lang="ja">通知</Description>
    <RuleTemplate name="ProcessPath" icon="processpath.gif" file="ProcessPath.rtu" process="true" workstep="true">
      <Description>Process Path</Description>
      <Description xml:lang="ja">プロセスパス</Description>
      <Description xml:lang="zh">监控</Description>
    </RuleTemplate>
    <RuleTemplate name="Timeout" icon="timeout.gif" file="Timeout.rtu" process="false" workstep="true">
      <Description>Time-Out</Description>
      <Description xml:lang="ja">タイムアウト</Description>
      <Description xml:lang="zh">超时</Description>
    </RuleTemplate>
  </RuleCategory>
  <RuleCategory name="metrics">
    <Description>Metrics</Description>
    <Description xml:lang="ja">メトリックス</Description>
    <RuleTemplate name="Monitor" icon="monitor.gif" file="Monitoring.rtu" process="true" workstep="true">
      <Description>Monitoring</Description>
      <Description xml:lang="ja">モニタ</Description>
      <Description xml:lang="zh">监控</Description>
    </RuleTemplate>    
    <RuleTemplate name="BusinessMetric" icon="businessmetric.gif" file="BusinessMetric.rtu" process="false" workstep="true">
      <Description>Business Metric</Description>
      <Description xml:lang="ja">ビジネスメトリック</Description>
      <Description xml:lang="zh">超时</Description>
    </RuleTemplate>
    <RuleTemplate name="DecisionCounter" icon="decisioncounter.gif" file="DecisionCounter.rtu" process="false" workstep="true">
      <Description>Decision Counter</Description>
      <Description xml:lang="ja">条件分岐カウンター</Description>
      <Description xml:lang="zh">超时</Description>
    </RuleTemplate>
  </RuleCategory>    
  <RuleCategory name="taskmanagement">
    <Description>Task Management</Description>
    <Description xml:lang="ja">タスク管理</Description>
    <RuleTemplate name="TaskAssignment" icon="taskassignment.gif" file="TaskAssignment.rtu" process="false" workstep="true">
      <Description>Task Assignment</Description>
      <Description xml:lang="ja">タスク割り当て</Description>
      <Description xml:lang="zh">超时</Description>
    </RuleTemplate>
  </RuleCategory>
  <RuleCategory name="integration">
    <Description>Integration</Description>
    <Description xml:lang="ja">インテグレーション</Description>
    <RuleTemplate name="ProcessControl" icon="processcontrol.gif" file="ProcessControl.rtu" process="true" workstep="false">
      <Description>ProcessControl</Description>
      <Description xml:lang="ja">プロセスコントロール</Description>
      <Description xml:lang="zh">超时</Description>
    </RuleTemplate>
    <RuleTemplate name="FilePoller" icon="filepoller.gif" file="FilePoller.rtu" process="true" workstep="false">
      <Description>FilePoller</Description>
      <Description xml:lang="ja">ファイルポーラー</Description>
      <Description xml:lang="zh">超时</Description>
    </RuleTemplate>    
  </RuleCategory>  
</Rules>
